name,price,rating
KVS PRT MODEL PAPER PLUS SOLVED PAPER AND PRACTICE SETS...,170,3.7
KVS PGT HISTORY (H),302,4.2
Sawal Hi Jawab Hain,150,4.4
Time Management (Revised And Expanded Edition) (Hindi),459,4.4
World's Greatest Books For Personal Growth & Wealth (Se...,175,4.4
Life's Amazing Secrets (Hindi): Jeevan Ke Adbhut Rahasy...,194,4.5
Rich Dad Poor Dad 20th Anniversary Edition - Robert T ...,295,4.4
Hindi - Trading Candlesticks and Chart Pattern Book | I...,129,4.1
Srimad Bhagavad Gita As It Is : HINDI-2018- New Edition...,175,4.8
The Hidden Hindu (Hindi Translation of the Hidden Hindu...,200,4.4
Examcart Latest Conquer Defence Series Agniveer Indian ...,135,4.2
Trading Chart Pattern Book (Breakout and Candlestick) i...,266,4
Jeetna Hai to Jid Karo - Jeetna hain to jid karo Secon...,149,4.4
Kahawato Se Kamyabi Ki Aur,199,4.5
Jeevan Ki Khoj,899,4.5
Atomic Habits with 1 Disc,255,4.5
Yakeen for NEET Droppers (Hindi) Physics Combo Set of 6...,261,4.3
Sambhog Se Samadhi Ki Aur - Part 1,270,4.3
Achchha Bolne Ki Kala Aur Kamyabi - Hindi Translation ...,205,4.2
Mujhe Banna Hai Upsc Topper,332,4.5
eVidya RPF/RPSF Constable Purush Avum Mahila 20 Practic...,265,4
All In One Hindi 'B' CBSE Kasha 10th Based On Latest NC...,335,3.7
The Magic,205,4.5
Jeet Aapki - Success,489,4.5
SSC English CGL Warrior Prashant Solanki sir | Tier I &...,340,4.6
SSC Reasoning 7200 TCS MCQ Chapter Wise 6th Edition Hin...,274,4.3
"26 Years UPSC Prelims Solved Papers in Hindi, Paper 1 &...",150,4.3
BPSC Preliminary Exam Solved Papers 2004 -2020 2nd Edit...,179,4.1
Rich dad book - Rich dad poor dad Hindi book with 1 Di...,504,4.4
Aditya Ranjan Sir Maths RPF Warrior 2nd Edition (Consta...,338,4.4
"Oswaal CBSE Question Bank Class 10 Hindi-A, Chapterwise...",158,3.8
Jawahar Navodaya Vidyalaya (JNV) GuideBook for Class 6 ...,250,4.3
UP Constable Reasoning by Vikramjeet sir | Tricks & Con...,220,4.1
The Power of your Subconscious Mind,194,4.3
Ikigai (Hindi),368,4.3
Vyaktitva Ka Sampoorna Vikas,380,4.5
eVidya NTA CUET UG 2024 All in one book for B.Sc. Secti...,214,4
"Oswaal CBSE Question Bank Class 9 Hindi-A, Chapterwise ...",199,4
Achchha Bolne Ki Kala Aur Kamyabi,199,4.2
Agni Ki Udaan,179,4.5
